{
  "id": "stone-bricks",
  "block_id": "minecraft:stone_bricks",
  "category": "brick",
  "color": "gray",
  "transparent": false,
  "light_emission": 0,
  "is_solid": true,
  "variants": {
    "stairs": "minecraft:stone_brick_stairs",
    "slab": "minecraft:stone_brick_slab",
    "wall": "minecraft:stone_brick_wall"
  },
  "used_by_styles": ["medieval", "gothic", "castle", "fantasy", "vanilla"]
}
