{
  "id": "cut-sandstone",
  "block_id": "minecraft:cut_sandstone",
  "category": "stone",
  "color": "pale tan with crisp tile seams",
  "transparent": false,
  "light_emission": 0,
  "is_solid": true,
  "variants": {
    "slab": "minecraft:cut_sandstone_slab"
  },
  "used_by_styles": ["modern", "mediterranean", "egyptian"]
}
