{
  "id": "smooth-stone",
  "block_id": "minecraft:smooth_stone",
  "category": "stone",
  "color": "uniform light gray",
  "transparent": false,
  "light_emission": 0,
  "is_solid": true,
  "variants": {
    "slab": "minecraft:smooth_stone_slab"
  },
  "used_by_styles": ["modern", "minimalist", "industrial"]
}
