{
  "id": "polished-blackstone-bricks",
  "block_id": "minecraft:polished_blackstone_bricks",
  "category": "brick",
  "color": "black",
  "transparent": false,
  "light_emission": 0,
  "is_solid": true,
  "variants": {
    "stairs": "minecraft:polished_blackstone_brick_stairs",
    "slab": "minecraft:polished_blackstone_brick_slab",
    "wall": "minecraft:polished_blackstone_brick_wall"
  },
  "used_by_styles": [
    "gothic",
    "fantasy",
    "medieval"
  ]
}
