{
  "id": "green-stained-glass",
  "block_id": "minecraft:green_stained_glass",
  "category": "glass",
  "color": "green",
  "transparent": true,
  "light_emission": 0,
  "is_solid": true,
  "variants": {
    "pane": "minecraft:green_stained_glass_pane"
  },
  "used_by_styles": ["gothic", "medieval", "fantasy"]
}
