{
  "id": "diorite",
  "block_id": "minecraft:diorite",
  "category": "stone",
  "color": "speckled white",
  "transparent": false,
  "light_emission": 0,
  "is_solid": true,
  "variants": {
    "stairs": "minecraft:diorite_stairs",
    "slab": "minecraft:diorite_slab",
    "wall": "minecraft:diorite_wall"
  },
  "used_by_styles": ["modern", "minimalist"]
}
