{
  "id": "polished-diorite",
  "block_id": "minecraft:polished_diorite",
  "category": "stone",
  "color": "smooth off-white",
  "transparent": false,
  "light_emission": 0,
  "is_solid": true,
  "variants": {
    "stairs": "minecraft:polished_diorite_stairs",
    "slab": "minecraft:polished_diorite_slab"
  },
  "used_by_styles": ["modern", "minimalist"]
}
