{
  "id": "cut-red-sandstone",
  "block_id": "minecraft:cut_red_sandstone",
  "category": "stone",
  "color": "rust red with crisp tile seams",
  "transparent": false,
  "light_emission": 0,
  "is_solid": true,
  "variants": {
    "slab": "minecraft:cut_red_sandstone_slab"
  },
  "used_by_styles": ["modern", "egyptian", "mediterranean"]
}
